{
  "schema_version": 1,
  "registry_id": "lacai.integration_contract_registry",
  "revision": 1,
  "authority_team": "ai_app",
  "teams": [
    {
      "team_id": "bsp_fw",
      "owns": ["device_media", "raw_transport", "accelerator_platform", "external_facts", "deployment_operations"],
      "must_not_own": ["model_semantics", "feature_semantics", "ai_authorization_decision"]
    },
    {
      "team_id": "ai_app",
      "owns": ["integration_contracts", "runtime", "feature_semantics", "metadata_query", "output_authorization"],
      "must_not_own": ["hardware_completion_attestation", "model_quality_attestation"]
    },
    {
      "team_id": "ai_model",
      "owns": ["model_artifacts", "preprocess_decode_semantics", "ontology", "golden_quality"],
      "must_not_own": ["fw_abi", "runtime_admission", "retention", "entitlement"]
    }
  ],
  "contracts": [
    {
      "contract_id": "C01",
      "contract_version": 1,
      "name": "raw_source",
      "owner_team": "bsp_fw",
      "producer_teams": ["bsp_fw"],
      "consumer_teams": ["ai_app"],
      "authority_document": "docs/contracts/fw_ai_app_contract.md",
      "max_message_bytes": 4096,
      "max_messages_per_second": 120,
      "clock": {"domain": "source_monotonic", "timestamp_unit": "ns", "mapping_required": true},
      "units": ["width:px", "height:px", "stride:bytes", "offset:bytes", "duration:ns"],
      "ownership": {"producer_retains_until": "final_reader_completion_ack", "consumer_release_signal": "session_epoch_and_buffer_id_ack", "timeout_is_completion": false, "disconnect_is_completion": false},
      "delivery": {"reliability": "bounded_latest", "idempotency_key": "session_epoch_and_buffer_id", "retry_policy": "no_frame_retry", "ordering": "source_sequence"},
      "security": {"authenticated_principal": "peer_credentials_and_lease", "authorization_scopes": ["source", "profile", "consumer"], "sensitive_data": ["raw_frame"], "deny_by_default": true},
      "required_fields": ["source_id", "source_epoch", "buffer_id", "planes", "allocation_bounds", "format", "color", "producer_completion", "consumer_completion", "reset_generation"],
      "error_codes": ["invalid_argument", "unauthorized", "incompatible", "resource_exhausted", "stale_generation", "recovery_required", "unavailable"]
    },
    {
      "contract_id": "C02",
      "contract_version": 1,
      "name": "accelerator_platform",
      "owner_team": "bsp_fw",
      "producer_teams": ["bsp_fw"],
      "consumer_teams": ["ai_app", "ai_model"],
      "authority_document": "docs/architecture/qualcomm_adapter.md",
      "max_message_bytes": 262144,
      "max_messages_per_second": 1,
      "clock": {"domain": "monotonic", "timestamp_unit": "ns", "mapping_required": false},
      "units": ["memory:bytes", "latency:us", "bandwidth:bytes_per_second", "temperature:millidegrees_celsius", "frequency:hz"],
      "ownership": {"producer_retains_until": "sdk_release_end", "consumer_release_signal": "completion_or_bsp_quiesce_receipt", "timeout_is_completion": false, "disconnect_is_completion": false},
      "delivery": {"reliability": "revisioned_snapshot", "idempotency_key": "platform_revision", "retry_policy": "replace_complete_snapshot", "ordering": "revision"},
      "security": {"authenticated_principal": "signed_platform_package", "authorization_scopes": ["device", "sdk", "accelerator"], "sensitive_data": ["signing_receipt"], "deny_by_default": true},
      "required_fields": ["soc", "image_revision", "sdk_abi", "toolchain", "allocator", "cache_fence", "completion", "reset_quiesce", "capabilities", "resource_thermal_envelope", "signing"],
      "error_codes": ["invalid_argument", "unauthorized", "incompatible", "resource_exhausted", "unsupported", "recovery_required", "unavailable"]
    },
    {
      "contract_id": "C03",
      "contract_version": 1,
      "name": "model_integration_kit",
      "owner_team": "ai_model",
      "producer_teams": ["ai_model"],
      "consumer_teams": ["ai_app", "bsp_fw"],
      "authority_document": "docs/contracts/model_integration.md",
      "max_message_bytes": 1048576,
      "max_messages_per_second": 1,
      "clock": {"domain": "none", "timestamp_unit": "none", "mapping_required": false},
      "units": ["tensor:elements", "memory:bytes", "latency:us", "cadence:frames_per_second", "confidence:ratio"],
      "ownership": {"producer_retains_until": "package_retirement", "consumer_release_signal": "integration_receipt", "timeout_is_completion": false, "disconnect_is_completion": false},
      "delivery": {"reliability": "immutable_package", "idempotency_key": "model_id_version_digest", "retry_policy": "whole_package_retry", "ordering": "model_version"},
      "security": {"authenticated_principal": "signed_model_package", "authorization_scopes": ["model", "target", "license"], "sensitive_data": ["model_artifact", "golden_media"], "deny_by_default": true},
      "required_fields": ["identity", "provenance", "artifact", "io", "preprocess", "quantization", "decode", "ontology", "temporal", "resource_envelope", "golden_m0_m4", "quality_m5", "known_limits", "rollback"],
      "error_codes": ["invalid_argument", "unauthorized", "incompatible", "digest_mismatch", "unsupported", "not_qualified", "unavailable"]
    },
    {
      "contract_id": "C04",
      "contract_version": 1,
      "name": "scene_calibration_time",
      "owner_team": "ai_app",
      "producer_teams": ["ai_app", "bsp_fw"],
      "consumer_teams": ["bsp_fw", "ai_model"],
      "authority_document": "docs/contracts/integration_contract_registry.md",
      "max_message_bytes": 262144,
      "max_messages_per_second": 10,
      "clock": {"domain": "source_monotonic", "timestamp_unit": "ns", "mapping_required": true},
      "units": ["coordinate:px_or_declared_crs", "distance:mm", "speed:mm_per_second", "angle:millidegrees", "uncertainty:declared_unit"],
      "ownership": {"producer_retains_until": "revision_superseded_after_drain", "consumer_release_signal": "applied_revision_receipt", "timeout_is_completion": false, "disconnect_is_completion": false},
      "delivery": {"reliability": "revisioned_snapshot", "idempotency_key": "scene_revision", "retry_policy": "replace_complete_snapshot", "ordering": "revision"},
      "security": {"authenticated_principal": "trusted_configuration_channel", "authorization_scopes": ["source", "scene", "signal", "schedule"], "sensitive_data": ["site_geometry", "access_fact"], "deny_by_default": true},
      "required_fields": ["source_id", "scene_revision", "coordinate_space", "zones_lines_lanes", "calibration_validity", "clock_mapping", "signal_or_access_revision", "uncertainty", "effective_interval"],
      "error_codes": ["invalid_argument", "unauthorized", "incompatible", "stale_revision", "not_observable", "expired", "unavailable"]
    },
    {
      "contract_id": "C05",
      "contract_version": 1,
      "name": "control_authorization_admission",
      "owner_team": "ai_app",
      "producer_teams": ["ai_app", "bsp_fw"],
      "consumer_teams": ["bsp_fw", "ai_model"],
      "authority_document": "docs/contracts/fw_usecase_control.md",
      "max_message_bytes": 262144,
      "max_messages_per_second": 20,
      "clock": {"domain": "monotonic", "timestamp_unit": "ns", "mapping_required": false},
      "units": ["revision:count", "validity:ns", "quota:declared_resource_unit"],
      "ownership": {"producer_retains_until": "published_runtime_generation", "consumer_release_signal": "generation_status_receipt", "timeout_is_completion": false, "disconnect_is_completion": false},
      "delivery": {"reliability": "transactional_snapshot", "idempotency_key": "request_id_and_expected_revision", "retry_policy": "cas_retry", "ordering": "control_revision"},
      "security": {"authenticated_principal": "authenticated_control_peer", "authorization_scopes": ["source", "usecase", "attribute", "output"], "sensitive_data": ["entitlement", "identity_scope"], "deny_by_default": true},
      "required_fields": ["installed", "entitled", "desired", "supported", "compatible", "admitted", "loaded", "running", "reason_code", "control_revision", "entitlement_revision", "runtime_generation"],
      "error_codes": ["invalid_argument", "unauthorized", "stale_revision", "idempotency_conflict", "incompatible", "resource_exhausted", "recovery_required"]
    },
    {
      "contract_id": "C06",
      "contract_version": 1,
      "name": "metadata_query",
      "owner_team": "ai_app",
      "producer_teams": ["ai_app"],
      "consumer_teams": ["bsp_fw"],
      "authority_document": "docs/planning/architecture_improvement/metadata_query_plan.md",
      "max_message_bytes": 1048576,
      "max_messages_per_second": 100,
      "clock": {"domain": "source_monotonic", "timestamp_unit": "ns", "mapping_required": true},
      "units": ["time:ns", "coordinate:declared_space", "confidence:ratio", "distance:mm", "speed:mm_per_second"],
      "ownership": {"producer_retains_until": "snapshot_or_page_expiry", "consumer_release_signal": "page_consumed_or_cancelled", "timeout_is_completion": false, "disconnect_is_completion": false},
      "delivery": {"reliability": "snapshot_paged", "idempotency_key": "query_id_and_snapshot_revision", "retry_policy": "resume_bounded_page", "ordering": "stable_page_cursor"},
      "security": {"authenticated_principal": "authenticated_query_peer", "authorization_scopes": ["source", "time", "field", "identity", "export"], "sensitive_data": ["identity", "plate", "trajectory", "embedding_reference"], "deny_by_default": true},
      "required_fields": ["query_id", "snapshot_revision", "projection", "filters", "coverage", "quality", "completeness", "retention", "page_budget", "authorization_revision"],
      "error_codes": ["invalid_argument", "unauthorized", "unsupported", "coverage_gap", "expired", "resource_exhausted", "cancelled"]
    },
    {
      "contract_id": "C07",
      "contract_version": 1,
      "name": "event_evidence",
      "owner_team": "ai_app",